sample_id,audio_path,reference,reference_normalized,prediction_raw,prediction_normalized,wer_raw,cer_raw,wer_normalized,cer_normalized,processing_time,category
1553,D:\SPIRE Internship\IISc_RESPIN_test_hi\D4\41398\IISc_RESPIN_hi_D4_41398_303106_F_AGRI_413028_40597576.wav,क्या मैं बालुई मिट्टी में मूंगफली की खेती कर सकता हूँ ?,क्या मैं बालुई मिट्टी में मूंगफली की खेती कर सकता हूँ ?,क्या मैं बालुई मिट्टी में मूंगफली की खेती कर सकता हूं,क्या मैं बालुई मिट्टी में मूंगफली की खेती कर सकता हूं,16.66666667,5.454545455,16.66666667,5.454545455,0.120298386,D_no_change
1554,D:\SPIRE Internship\IISc_RESPIN_test_hi\D4\41398\IISc_RESPIN_hi_D4_41398_303106_F_AGRI_413027_40598236.wav,मैं अम्लीय मिट्टी का उपचार कैसे करूँ ?,मैं अम्लीय मिट्टी का उपचार कैसे करूँ ?,मैं एमलीए मिट्टी का उपचार कैसे करूँ,मैं एमलीए मिट्टी का उपचार कैसे करूँ,25.0,13.15789474,25.0,13.15789474,0.099747181,D_no_change
1555,D:\SPIRE Internship\IISc_RESPIN_test_hi\D4\41398\IISc_RESPIN_hi_D4_41398_303106_F_BANK_413919_40598297.wav,अपने बच्चों के लिए मध्याह्न भोजन योजना का चुनाव कैसे करें ?,अपने बच्चों के लिए मध्याह्न भोजन योजना का चुनाव कैसे करें ?,अपने बच्चों के लिए मध्यान भोजन योजना का चुनाव कैसे करें,अपने बच्चों के लिए मध्यान भोजन योजना का चुनाव कैसे करें,16.66666667,6.779661017,16.66666667,6.779661017,0.120064497,D_no_change
1556,D:\SPIRE Internship\IISc_RESPIN_test_hi\D4\41398\IISc_RESPIN_hi_D4_41398_303106_F_BANK_413870_40598322.wav,एन.ई.एफ.टी का उपयोग करके हस्तांतरित की जा सकने वाली न्यूनतम राशि क्या है ?,एन.ई.एफ.टी का उपयोग करके हस्तांतरित की जा सकने वाली न्यूनतम राशि क्या है ?,एनीएफ्टी का उपयोग करके हस्तांतरित की जा सकने वाली न्यूनतम राशि क्या है,एनीएफ्टी का उपयोग करके हस्तांतरित की जा सकने वाली न्यूनतम राशि क्या है,14.28571429,8.108108108,14.28571429,8.108108108,0.161887407,D_no_change
1557,D:\SPIRE Internship\IISc_RESPIN_test_hi\D4\41398\IISc_RESPIN_hi_D4_41398_303106_F_BANK_413748_40598346.wav,क्रेडिट कार्ड के द्वारा क्या क्या खरीद सकते हैं ?,क्रेडिट कार्ड के द्वारा क्या क्या खरीद सकते हैं ?,क्रेडिट कार्ड के द्वारा क्या कया खरीद सकते हैं,क्रेडिट कार्ड के द्वारा क्या कया खरीद सकते हैं,20.0,6.12244898,20.0,6.12244898,0.122529984,D_no_change
1558,D:\SPIRE Internship\IISc_RESPIN_test_hi\D4\41398\IISc_RESPIN_hi_D4_41398_303106_F_BANK_416790_40598409.wav,सभी तरह के गांवों में राष्ट्रीय ग्रामीण आजीविका मिशन को लागू किया जा रहा है,सभी तरह के गांवों में राष्ट्रीय ग्रामीण आजीविका मिशन को लागू किया जा रहा है,सभी तरह के गांवो में राष्ट्रीय ग्रामीण आजीविका मिशन को लागू किया जा रहा है,सभी तरह के गांवो में राष्ट्रीय ग्रामीण आजीविका मिशन को लागू किया जा रहा है,6.666666667,1.333333333,6.666666667,1.333333333,0.163014889,D_no_change
1559,D:\SPIRE Internship\IISc_RESPIN_test_hi\D4\41398\IISc_RESPIN_hi_D4_41398_303106_F_BANK_414911_40598428.wav,अंतर्राष्ट्रीय कराधान देशों के मध्य कर प्रक्रियाओं को सुव्यवस्थित करता है,अंतर्राष्ट्रीय कराधान देशों के मध्य कर प्रक्रियाओं को सुव्यवस्थित करता है,अंतरराष्ट्रीय कराधान देशों के मध्यकर प्रक्रियाओं को सुवयवस्तित करता है,अंतरराष्ट्रीय कराधान देशों के मध्यकर प्रक्रियाओं को सुवयवस्तित करता है,36.36363636,5.479452055,36.36363636,5.479452055,0.156532526,D_no_change
1560,D:\SPIRE Internship\IISc_RESPIN_test_hi\D4\41398\IISc_RESPIN_hi_D4_41398_303106_F_AGRI_414791_40598456.wav,दैनिक मौसम अवलोकन प्रत्येक दिन कई मौसम तत्वों के अवलोकनों की सूची बनाते है,दैनिक मौसम अवलोकन प्रत्येक दिन कई मौसम तत्वों के अवलोकनों की सूची बनाते है,दैनिक मौसम अवलोकन प्रत्येक दिन कई मौसम तत्वों के अवलोकनों की सूची बनाते हैं,दैनिक मौसम अवलोकन प्रत्येक दिन कई मौसम तत्वों के अवलोकनों की सूची बनाते हैं,7.142857143,1.351351351,7.142857143,1.351351351,0.200004816,D_no_change
1561,D:\SPIRE Internship\IISc_RESPIN_test_hi\D4\41398\IISc_RESPIN_hi_D4_41398_303106_F_BANK_414697_40598459.wav,कर के वितरण पर प्रभाव आय और सम्पति की असमनताओं को कम करना है,कर के वितरण पर प्रभाव आय और सम्पति की असमनताओं को कम करना है,कर के वितरण पर प्रभाव आययर संपत्ति की असमन्नताओं को कम करना है,कर के वितरण पर प्रभाव आययर संपत्ति की असमन्नताओं को कम करना है,28.57142857,13.33333333,28.57142857,13.33333333,0.151034355,D_no_change
1562,D:\SPIRE Internship\IISc_RESPIN_test_hi\D4\41398\IISc_RESPIN_hi_D4_41398_303106_F_AGRI_414315_40598462.wav,जब वर्षा कम होती है या नहीं होती है तो किसान अन्य जल संसाधनों पर निर्भर होते हैं,जब वर्षा कम होती है या नहीं होती है तो किसान अन्य जल संसाधनों पर निर्भर होते हैं,जब वर्षा कम होती है या नहीं होती है तो किसान अन्य जलसंसाधनों पर निर्भर होते हैं,जब वर्षा कम होती है या नहीं होती है तो किसान अन्य जलसंसाधनों पर निर्भर होते हैं,11.11111111,1.25,11.11111111,1.25,0.18395257,D_no_change
1563,D:\SPIRE Internship\IISc_RESPIN_test_hi\D4\41398\IISc_RESPIN_hi_D4_41398_303106_F_AGRI_414363_40599052.wav,पशु कल्याण गैर मानव पशु कल्याण के मानक संदर्भों के बीच भिन्न होते हैं,पशु कल्याण गैर मानव पशु कल्याण के मानक संदर्भों के बीच भिन्न होते हैं,पशुकल्याण गैरमानव पशु कल्याण के मानक समदर्भों के बीच भिन्न होते हैं,पशुकल्याण गैरमानव पशु कल्याण के मानक समदर्भों के बीच भिन्न होते हैं,35.71428571,4.347826087,35.71428571,4.347826087,0.202922344,D_no_change
1564,D:\SPIRE Internship\IISc_RESPIN_test_hi\D4\41398\IISc_RESPIN_hi_D4_41398_303106_F_BANK_414264_40599112.wav,दुर्घटना बीमा कवरेज न केवल बीमित व्यक्ति के लिए बल्कि उनके आश्रितों के लिए भी है,दुर्घटना बीमा कवरेज न केवल बीमित व्यक्ति के लिए बल्कि उनके आश्रितों के लिए भी है,दुर्घटना बीमा कवरेज नाम केवल बीमित व्यक्ति के लिए बल्कि उनके हासिलतों के लिए भी है,दुर्घटना बीमा कवरेज नाम केवल बीमित व्यक्ति के लिए बल्कि उनके हासिलतों के लिए भी है,12.5,8.75,12.5,8.75,0.167011499,D_no_change
1565,D:\SPIRE Internship\IISc_RESPIN_test_hi\D4\41398\IISc_RESPIN_hi_D4_41398_303106_F_BANK_416890_40599117.wav,सरकार द्वारा जारी बॉन्ड तरजीही शेयर ऋण पत्र आदि प्रतिभूतियों की श्रेणी में आते हैं,सरकार द्वारा जारी बॉन्ड तरजीही शेयर ऋण पत्र आदि प्रतिभूतियों की श्रेणी में आते हैं,सरकार द्वारा जारी बॉंडतरजीही सेयर ऋणपत्र ादि पृथभूतियों की श्रेणी में आते हैं,सरकार द्वारा जारी बॉंडतरजीही सेयर ऋणपत्र ादि पृथभूतियों की श्रेणी में आते हैं,46.66666667,12.19512195,46.66666667,12.19512195,0.173344135,D_no_change
1566,D:\SPIRE Internship\IISc_RESPIN_test_hi\D4\41398\IISc_RESPIN_hi_D4_41398_303106_F_BANK_414475_40599312.wav,मुझे सम्बद्ध ऋण लेने की आवश्यकता है,मुझे सम्बद्ध ऋण लेने की आवश्यकता है,मुझे संबद्ध ऋण लेने की आवश्यकता है,मुझे संबद्ध ऋण लेने की आवश्यकता है,14.28571429,5.714285714,14.28571429,5.714285714,0.104948044,D_no_change
1567,D:\SPIRE Internship\IISc_RESPIN_test_hi\D4\41405\IISc_RESPIN_hi_D4_41405_334603_F_AGRI_413021_40592778.wav,क्या पालक रबी के मौसम में सबसे अधिक उगता है ?,क्या पालक रबी के मौसम में सबसे अधिक उगता है ?,क्या पालक रभी के मौसम में सबसे अधिक हउगता है,क्या पालक रभी के मौसम में सबसे अधिक हउगता है,27.27272727,8.888888889,27.27272727,8.888888889,0.112615585,D_no_change
1568,D:\SPIRE Internship\IISc_RESPIN_test_hi\D4\41405\IISc_RESPIN_hi_D4_41405_334603_F_BANK_413735_40592781.wav,मैंने मूल रकम के अलावा कितनी राशि ब्याज के रूप में जमा कराई है ?,मैंने मूल रकम के अलावा कितनी राशि ब्याज के रूप में जमा कराई है ?,मैंने मूल रकम के अलावा कितनी राशि ब्याज के रूप में जमा कराई है,मैंने मूल रकम के अलावा कितनी राशि ब्याज के रूप में जमा कराई है,6.666666667,3.125,6.666666667,3.125,0.125261307,D_no_change
1569,D:\SPIRE Internship\IISc_RESPIN_test_hi\D4\41405\IISc_RESPIN_hi_D4_41405_334603_F_AGRI_413022_40593214.wav,बाजरा की बुवाई किस मौसम में की जाती है ?,बाजरा की बुवाई किस मौसम में की जाती है ?,बाजरा की बुआई किस मौसम में की जाती है,बाजरा की बुआई किस मौसम में की जाती है,20.0,10.0,20.0,10.0,0.101897717,D_no_change
1570,D:\SPIRE Internship\IISc_RESPIN_test_hi\D4\41405\IISc_RESPIN_hi_D4_41405_334603_F_AGRI_413028_40593293.wav,क्या मैं बालुई मिट्टी में मूंगफली की खेती कर सकता हूँ ?,क्या मैं बालुई मिट्टी में मूंगफली की खेती कर सकता हूँ ?,क्या मैं बालुई मिट्टी में मूंग खवली की खेती कर सकता हूं,क्या मैं बालुई मिट्टी में मूंग खवली की खेती कर सकता हूं,33.33333333,10.90909091,33.33333333,10.90909091,0.110099792,D_no_change
1571,D:\SPIRE Internship\IISc_RESPIN_test_hi\D4\41405\IISc_RESPIN_hi_D4_41405_334603_F_AGRI_413024_40593328.wav,तारामीरा की कटाई कब की जाती है ?,तारामीरा की कटाई कब की जाती है ?,तारा मीरा की कटाई कब की जाती है,तारा मीरा की कटाई कब की जाती है,37.5,9.375,37.5,9.375,0.107699871,D_no_change
1572,D:\SPIRE Internship\IISc_RESPIN_test_hi\D4\41405\IISc_RESPIN_hi_D4_41405_334603_F_BANK_413744_40595521.wav,आधार के.वाई.सी क्या है ?,आधार के.वाई.सी क्या है ?,आधार के वाइसिक क्या है,आधार के वाइसिक क्या है,60.0,29.16666667,60.0,29.16666667,0.061354637,D_no_change
1573,D:\SPIRE Internship\IISc_RESPIN_test_hi\D4\41405\IISc_RESPIN_hi_D4_41405_334603_F_AGRI_413030_40595549.wav,क्या मैं काली मिट्टी में कपास की फसल लगाऊँ ?,क्या मैं काली मिट्टी में कपास की फसल लगाऊँ ?,क्या मैं काली मिट्टी में कपास की फसल लगाूं,क्या मैं काली मिट्टी में कपास की फसल लगाूं,20.0,9.090909091,20.0,9.090909091,0.060497522,D_no_change
1574,D:\SPIRE Internship\IISc_RESPIN_test_hi\D4\41405\IISc_RESPIN_hi_D4_41405_334603_F_AGRI_413026_40595780.wav,बाजरे की फसल के संकरो के नाम बताओ,बाजरे की फसल के संकरो के नाम बताओ,बाजरी की फसल के संकड़ों का नाम बताया,बाजरी की फसल के संकड़ों का नाम बताया,50.0,21.21212121,50.0,21.21212121,0.080035925,D_no_change
1575,D:\SPIRE Internship\IISc_RESPIN_test_hi\D4\41405\IISc_RESPIN_hi_D4_41405_334603_F_AGRI_416398_40595788.wav,भारत सरकार द्वारा बनाए गए कृषि कानूनों को कुछ किसान संगठनों ने अनुचित बताया है,भारत सरकार द्वारा बनाए गए कृषि कानूनों को कुछ किसान संगठनों ने अनुचित बताया है,भारत सरकार द्वारा बनाए गए कृषि कानूनों को कुछ किसान संगठनों से अनुचितित बताया है,भारत सरकार द्वारा बनाए गए कृषि कानूनों को कुछ किसान संगठनों से अनुचितित बताया है,13.33333333,3.846153846,13.33333333,3.846153846,0.172221184,D_no_change
1579,D:\SPIRE Internship\IISc_RESPIN_test_hi\D4\41405\IISc_RESPIN_hi_D4_41405_334603_F_BANK_416778_40596309.wav,यह विभाग भारत सरकार को जवाबदेह होता है,यह विभाग भारत सरकार को जवाबदेह होता है,यह विभाग भारत सरकार को जवाब दे होता है,यह विभाग भारत सरकार को जवाब दे होता है,25.0,5.263157895,25.0,5.263157895,0.111880541,D_no_change
1580,D:\SPIRE Internship\IISc_RESPIN_test_hi\D4\41405\IISc_RESPIN_hi_D4_41405_334603_F_BANK_415006_40597047.wav,मंडी में हाइब्रिड बीज बिकने लगे हैं,मंडी में हाइब्रिड बीज बिकने लगे हैं,मंडी में हाईब्रिड बीज बीगने लगे हैं,मंडी में हाईब्रिड बीज बीगने लगे हैं,28.57142857,8.571428571,28.57142857,8.571428571,0.063988209,D_no_change
1581,D:\SPIRE Internship\IISc_RESPIN_test_hi\D4\41405\IISc_RESPIN_hi_D4_41405_334603_F_BANK_414061_40597115.wav,भारत में दो तरह के ऋण होते है पहला सुरक्षित ऋण दूसरा असुरक्षित ऋण,भारत में दो तरह के ऋण होते है पहला सुरक्षित ऋण दूसरा असुरक्षित ऋण,भारत में दो तरह के रण होते हैं पहला सुरक्षित रण दूसरा नुसुरक्षित रण,भारत में दो तरह के रण होते हैं पहला सुरक्षित रण दूसरा नुसुरक्षित रण,35.71428571,9.230769231,35.71428571,9.230769231,0.124361038,D_no_change
1582,D:\SPIRE Internship\IISc_RESPIN_test_hi\D4\41405\IISc_RESPIN_hi_D4_41405_334603_F_BANK_416206_40597150.wav,माइक्रो फाइनेंसर ऋण और संस्थान विशिष्ट पुनर्भुगतान योजनाओं पर ब्याज लेते हैं,माइक्रो फाइनेंसर ऋण और संस्थान विशिष्ट पुनर्भुगतान योजनाओं पर ब्याज लेते हैं,माइक्रोफाइनेंसट करण और संस्थान विशिष्ट पूर्ण भुगतान योजनाओं पर ब्याज देते हैं,माइक्रोफाइनेंसट करण और संस्थान विशिष्ट पूर्ण भुगतान योजनाओं पर ब्याज देते हैं,50.0,11.84210526,50.0,11.84210526,0.129631996,D_no_change
1583,D:\SPIRE Internship\IISc_RESPIN_test_hi\D4\41812\IISc_RESPIN_hi_D4_41812_342308_F_BANK_413734_40844980.wav,मेरे ऋण भुगतान की कितनी किश्त बनाए गए हैं ?,मेरे ऋण भुगतान की कितनी किश्त बनाए गए हैं ?,मेरे ऋण भुगतान की कितनी किश्त बनाए गए हैं,मेरे ऋण भुगतान की कितनी किश्त बनाए गए हैं,10.0,4.651162791,10.0,4.651162791,0.123895884,D_no_change
1584,D:\SPIRE Internship\IISc_RESPIN_test_hi\D4\41812\IISc_RESPIN_hi_D4_41812_342308_F_BANK_413677_40845000.wav,एन.ई.एफ.टी के माध्यम से एक बार में अधिकतम कितनी राशि ट्रांसफर की जा सकती है ?,एन.ई.एफ.टी के माध्यम से एक बार में अधिकतम कितनी राशि ट्रांसफर की जा सकती है ?,एनईएफटी के माध्यम से एक बार में अधिकतम कितनी राशि ट्रांसफर की जा सकती है,एनईएफटी के माध्यम से एक बार में अधिकतम कितनी राशि ट्रांसफर की जा सकती है,12.5,6.493506494,12.5,6.493506494,0.207226038,D_no_change
1585,D:\SPIRE Internship\IISc_RESPIN_test_hi\D4\41812\IISc_RESPIN_hi_D4_41812_342308_F_AGRI_413025_40846067.wav,मक्का की सबसे अच्छी उपज वाली किस्म कौनसी है ?,मक्का की सबसे अच्छी उपज वाली किस्म कौनसी है ?,मक्का की सबसे अच्छी ऊपज वाली किस्म कौनसी है,मक्का की सबसे अच्छी ऊपज वाली किस्म कौनसी है,20.0,6.666666667,20.0,6.666666667,0.126537085,D_no_change
1586,D:\SPIRE Internship\IISc_RESPIN_test_hi\D4\41812\IISc_RESPIN_hi_D4_41812_342308_F_BANK_413870_40846088.wav,एन.ई.एफ.टी का उपयोग करके हस्तांतरित की जा सकने वाली न्यूनतम राशि क्या है ?,एन.ई.एफ.टी का उपयोग करके हस्तांतरित की जा सकने वाली न्यूनतम राशि क्या है ?,एनईएफटी का उपयोग करके हस्तांतरित की जा सकने वाली न्यूनतम राशि क्या है,एनईएफटी का उपयोग करके हस्तांतरित की जा सकने वाली न्यूनतम राशि क्या है,14.28571429,6.756756757,14.28571429,6.756756757,0.154367208,D_no_change
1587,D:\SPIRE Internship\IISc_RESPIN_test_hi\D4\41812\IISc_RESPIN_hi_D4_41812_342308_F_BANK_413735_40850643.wav,मैंने मूल रकम के अलावा कितनी राशि ब्याज के रूप में जमा कराई है ?,मैंने मूल रकम के अलावा कितनी राशि ब्याज के रूप में जमा कराई है ?,मैंने मूल रकम के अलावा कितनी राशि ब्याज के रूप में जमा कराई है,मैंने मूल रकम के अलावा कितनी राशि ब्याज के रूप में जमा कराई है,6.666666667,3.125,6.666666667,3.125,0.117943287,D_no_change
1588,D:\SPIRE Internship\IISc_RESPIN_test_hi\D4\41812\IISc_RESPIN_hi_D4_41812_342308_F_BANK_413744_40850656.wav,आधार के.वाई.सी क्या है ?,आधार के.वाई.सी क्या है ?,आधार केव इसी क्या है,आधार केव इसी क्या है,60.0,25.0,60.0,25.0,0.09023428,D_no_change
1589,D:\SPIRE Internship\IISc_RESPIN_test_hi\D4\41812\IISc_RESPIN_hi_D4_41812_342308_F_AGRI_413027_40850869.wav,मैं अम्लीय मिट्टी का उपचार कैसे करूँ ?,मैं अम्लीय मिट्टी का उपचार कैसे करूँ ?,मैं अमलिए मिट्टी का उपचार कैसे करूं,मैं अमलिए मिट्टी का उपचार कैसे करूं,37.5,15.78947368,37.5,15.78947368,0.101763725,D_no_change
