sample_id,audio_path,reference,reference_normalized,prediction_raw,prediction_normalized,wer_raw,cer_raw,wer_normalized,cer_normalized,processing_time,category
800,D:\SPIRE Internship\IISc_RESPIN_test_hi\D2\40920\IISc_RESPIN_hi_D2_40920_207241_M_AGRI_404625_40332859.wav,लेगहार्न किस्म की मुर्गी विश्व में सभी मुर्गियों से अधिक अंडे देती है,लेगहार्न किस्म की मुर्गी विश्व में सभी मुर्गियों से अधिक अंडे देती है,लेक हार्न किस्म की मुर्गी भिश्व में सभी मुर्गियों से अधिक अंडें देती है,लेक हार्न किस्म की मुर्गी भिश्व में सभी मुर्गियों से अधिक अंडें देती है,30.76923077,5.797101449,30.76923077,5.797101449,0.116325378,D_no_change
801,D:\SPIRE Internship\IISc_RESPIN_test_hi\D2\40920\IISc_RESPIN_hi_D2_40920_207241_M_AGRI_404525_40332871.wav,प्रीतम पता है मेक्सिको में अम्लान पौधे से स्वादिष्ट कैंडी और टॉफी बनाई जाती है,प्रीतम पता है मेक्सिको में अम्लान पौधे से स्वादिष्ट कैंडी और टॉफी बनाई जाती है,परीतम पता हे मैक्सिको में अमलान पौधे से स्वादिष्ट कैंडी और टॉफी बनाई जाती है,परीतम पता हे मैक्सिको में अमलान पौधे से स्वादिष्ट कैंडी और टॉफी बनाई जाती है,26.66666667,5.128205128,26.66666667,5.128205128,0.199030161,D_no_change
802,D:\SPIRE Internship\IISc_RESPIN_test_hi\D2\40920\IISc_RESPIN_hi_D2_40920_207241_M_AGRI_406501_40332880.wav,जिओडक का अधिकांश निर्यात चीन हांगकांग और जापान को भेजा जाता है,जिओडक का अधिकांश निर्यात चीन हांगकांग और जापान को भेजा जाता है,जिओडक का अधिकांश निर्यात चीन हांगकांग और जापान को भेजा जाता,जिओडक का अधिकांश निर्यात चीन हांगकांग और जापान को भेजा जाता,8.333333333,4.838709677,8.333333333,4.838709677,0.147883177,D_no_change
803,D:\SPIRE Internship\IISc_RESPIN_test_hi\D2\40920\IISc_RESPIN_hi_D2_40920_207241_M_AGRI_406856_40332899.wav,स्ट्रेच्ड रबर में चेन लगभग रैखिक होती है,स्ट्रेच्ड रबर में चेन लगभग रैखिक होती है,स्टेस ट्रबर वह चीन लगभग रैखिक होती है,स्टेस ट्रबर वह चीन लगभग रैखिक होती है,50.0,25.0,50.0,25.0,0.100556612,D_no_change
804,D:\SPIRE Internship\IISc_RESPIN_test_hi\D2\40933\IISc_RESPIN_hi_D2_40933_207001_M_AGRI_404638_40336687.wav,अधिंकाश खेतिहर मजदूरों के टास अपनी जमीन नहीं होती,अधिंकाश खेतिहर मजदूरों के टास अपनी जमीन नहीं होती,अधिकांश खेतीहर मजदूरों के टास अपनी जमीन नहीं होती,अधिकांश खेतीहर मजदूरों के टास अपनी जमीन नहीं होती,22.22222222,6.12244898,22.22222222,6.12244898,0.149236441,D_no_change
806,D:\SPIRE Internship\IISc_RESPIN_test_hi\D2\40933\IISc_RESPIN_hi_D2_40933_207001_M_BANK_404768_40336718.wav,वित्तीय इंजीनियरिंग में मात्रात्मक विश्लेषण का क्या महत्व है ?,वित्तीय इंजीनियरिंग में मात्रात्मक विश्लेषण का क्या महत्व है ?,वित्तीय इंजीनियरिंग में मात्रात्मक विश्लेषण का क्या महत्व है,वित्तीय इंजीनियरिंग में मात्रात्मक विश्लेषण का क्या महत्व है,10.0,3.225806452,10.0,3.225806452,0.129964113,D_no_change
807,D:\SPIRE Internship\IISc_RESPIN_test_hi\D2\40933\IISc_RESPIN_hi_D2_40933_207001_M_AGRI_406674_40336955.wav,"जिओडक एक समुद्री द्विवार्षिक मोलस्क , जो प्रशांत नॉर्थवेस्ट का मूल निवासी है","जिओडक एक समुद्री द्विवार्षिक मोलस्क , जो प्रशांत नॉर्थवेस्ट का मूल निवासी है",जियोडक एक समुद्री देवासे मोलस्क जो प्रशांत नॉर्थवेस्ट का मूल निवासी है,जियोडक एक समुद्री देवासे मोलस्क जो प्रशांत नॉर्थवेस्ट का मूल निवासी है,23.07692308,15.78947368,23.07692308,15.78947368,0.160335779,D_no_change
809,D:\SPIRE Internship\IISc_RESPIN_test_hi\D2\40933\IISc_RESPIN_hi_D2_40933_207001_M_AGRI_404783_40340045.wav,अमेरिका में डेयरी गायों के बारे में सत्रह परसेंट बोवाइन हार्मोन से इंजेक्ट किया जाता है,अमेरिका में डेयरी गायों के बारे में सत्रह परसेंट बोवाइन हार्मोन से इंजेक्ट किया जाता है,अमेरिका में डेयरी गायों के बारे में <unk><unk><unk> परसेंट बोवाइन हार्मोन से इंजेप्ट किया जाता है,अमेरिका में डेयरी गायों के बारे में <unk><unk><unk> परसेंट बोवाइन हार्मोन से इंजेप्ट किया जाता है,12.5,18.3908046,12.5,18.3908046,0.221684694,D_no_change
811,D:\SPIRE Internship\IISc_RESPIN_test_hi\D2\40933\IISc_RESPIN_hi_D2_40933_207001_M_BANK_408335_40340774.wav,ऋण पात्रता क्या है ?,ऋण पात्रता क्या है ?,ऋण पात्रता क्या है,ऋण पात्रता क्या है,20.0,10.0,20.0,10.0,0.067606926,D_no_change
813,D:\SPIRE Internship\IISc_RESPIN_test_hi\D2\40933\IISc_RESPIN_hi_D2_40933_207001_M_BANK_408349_40341164.wav,क्या सीधे मेरे बैंक खाते से पैसे कटेंगे ?,क्या सीधे मेरे बैंक खाते से पैसे कटेंगे ?,किलिए मेरे बैंक खाते से पैसे करतेी,किलिए मेरे बैंक खाते से पैसे करतेी,44.44444444,34.14634146,44.44444444,34.14634146,0.059886217,D_no_change
814,D:\SPIRE Internship\IISc_RESPIN_test_hi\D2\40933\IISc_RESPIN_hi_D2_40933_207001_M_BANK_408331_40341322.wav,मैं अपने खाते से किसी को पैसे कैसे भेज सकता हूँ ?,मैं अपने खाते से किसी को पैसे कैसे भेज सकता हूँ ?,मैं अपने खाते से किसी को पैसे कैसे भेज सकता हूं,मैं अपने खाते से किसी को पैसे कैसे भेज सकता हूं,16.66666667,6.12244898,16.66666667,6.12244898,0.115598679,D_no_change
815,D:\SPIRE Internship\IISc_RESPIN_test_hi\D2\40933\IISc_RESPIN_hi_D2_40933_207001_M_BANK_408354_40341903.wav,बैंक में खाता खोलने के लिए के.वाई.सी कैसे कराएँ ?,बैंक में खाता खोलने के लिए के.वाई.सी कैसे कराएँ ?,बैंक में खाता खोलने के लिए केवाईसी कैसे करा,बैंक में खाता खोलने के लिए केवाईसी कैसे करा,30.0,12.24489796,30.0,12.24489796,0.104177237,D_no_change
816,D:\SPIRE Internship\IISc_RESPIN_test_hi\D2\41243\IISc_RESPIN_hi_D2_41243_207247_F_BANK_421568_40612789.wav,"काला बाजार में अवैध नशीली दवाओं का व्यापार , वेश्यावृत्ति अवैध मुद्रा लेनदेन , और मानव तस्करी शामिल है","काला बाजार में अवैध नशीली दवाओं का व्यापार , वेश्यावृत्ति अवैध मुद्रा लेनदेन , और मानव तस्करी शामिल है",काला बाजार में अवैध नसीली दवाओं का व्यापार वैश्यवति अवैध मुद्रा लेनदेन और मानव तस्करी शामिल है,काला बाजार में अवैध नसीली दवाओं का व्यापार वैश्यवति अवैध मुद्रा लेनदेन और मानव तस्करी शामिल है,21.05263158,9.803921569,21.05263158,9.803921569,0.220223665,D_no_change
817,D:\SPIRE Internship\IISc_RESPIN_test_hi\D2\41243\IISc_RESPIN_hi_D2_41243_207247_F_AGRI_406608_40612792.wav,मधुमक्खी का छत्ता एक बन्द संरचना है जिसमें ऍपिस उपवंश की मधुमक्खी की कुछ जातियाँ रहती और अपने बच्चे पालती है,मधुमक्खी का छत्ता एक बन्द संरचना है जिसमें ऍपिस उपवंश की मधुमक्खी की कुछ जातियाँ रहती और अपने बच्चे पालती है,मधुमक्की का छत्ता एक बंद संरचना है जिसमें एपिस उपवंश की मधुमक्की की कुछ जातियां रहती और अपने बच्चे पालती हैं,मधुमक्की का छत्ता एक बंद संरचना है जिसमें एपिस उपवंश की मधुमक्की की कुछ जातियां रहती और अपने बच्चे पालती हैं,28.57142857,6.481481481,28.57142857,6.481481481,0.260064363,D_no_change
818,D:\SPIRE Internship\IISc_RESPIN_test_hi\D2\41243\IISc_RESPIN_hi_D2_41243_207247_F_BANK_421592_40612796.wav,बचत बैंक की उत्पत्ति यूरोप में आबादी के सभी स्तरों पर बचत उत्पादों तक पहुंच प्रदान करने के लिए हुई थी,बचत बैंक की उत्पत्ति यूरोप में आबादी के सभी स्तरों पर बचत उत्पादों तक पहुंच प्रदान करने के लिए हुई थी,बचत बैंकों की उत्पत्ति यूरोप में आबादी के सभी स्तरों पर वचत उत्पादों तक पहुंच प्रदान करने के लिए हुई थी,बचत बैंकों की उत्पत्ति यूरोप में आबादी के सभी स्तरों पर वचत उत्पादों तक पहुंच प्रदान करने के लिए हुई थी,9.523809524,2.97029703,9.523809524,2.97029703,0.219997644,D_no_change
819,D:\SPIRE Internship\IISc_RESPIN_test_hi\D2\41243\IISc_RESPIN_hi_D2_41243_207247_F_AGRI_407674_40613023.wav,खेतों में कितने प्रकार के उपकरण की जरूरत होती है ?,खेतों में कितने प्रकार के उपकरण की जरूरत होती है ?,खेतों में कितने प्रकार के उपकरण की जरूरत होती है,खेतों में कितने प्रकार के उपकरण की जरूरत होती है,9.090909091,4.0,9.090909091,4.0,0.12185955,D_no_change
820,D:\SPIRE Internship\IISc_RESPIN_test_hi\D2\41243\IISc_RESPIN_hi_D2_41243_207247_F_BANK_408352_40613024.wav,कृषि ऋण कैसे चुकाएँ ?,कृषि ऋण कैसे चुकाएँ ?,कृषि ऋिण कैसे चुका है,कृषि ऋिण कैसे चुका है,60.0,23.80952381,60.0,23.80952381,0.077352285,D_no_change
821,D:\SPIRE Internship\IISc_RESPIN_test_hi\D2\41243\IISc_RESPIN_hi_D2_41243_207247_F_BANK_408439_40613025.wav,जमा और निवेश करते समय किन बातों का ध्यान रखें ?,जमा और निवेश करते समय किन बातों का ध्यान रखें ?,जमा और निवेश करते समय किन बातों का ध्यान रखें,जमा और निवेश करते समय किन बातों का ध्यान रखें,9.090909091,4.255319149,9.090909091,4.255319149,0.113790035,D_no_change
822,D:\SPIRE Internship\IISc_RESPIN_test_hi\D2\41243\IISc_RESPIN_hi_D2_41243_207247_F_BANK_408613_40613027.wav,स्वास्थ्य बीमा के बारे में जानकारी दे ?,स्वास्थ्य बीमा के बारे में जानकारी दे ?,स्वास्थ्य बीमा के बारे में जानकारी दें,स्वास्थ्य बीमा के बारे में जानकारी दें,25.0,5.128205128,25.0,5.128205128,0.102358103,D_no_change
823,D:\SPIRE Internship\IISc_RESPIN_test_hi\D2\41243\IISc_RESPIN_hi_D2_41243_207247_F_BANK_408429_40613030.wav,खाता खोलते समय किन बातों को ध्यान में रखा जाए ?,खाता खोलते समय किन बातों को ध्यान में रखा जाए ?,खाता खोलते समय किन बातों को ध्यान में रखा जाए,खाता खोलते समय किन बातों को ध्यान में रखा जाए,9.090909091,4.255319149,9.090909091,4.255319149,0.117591143,D_no_change
824,D:\SPIRE Internship\IISc_RESPIN_test_hi\D2\41243\IISc_RESPIN_hi_D2_41243_207247_F_AGRI_407697_40613033.wav,किसानों को धान कब बेचना चाहिए ?,किसानों को धान कब बेचना चाहिए ?,किसानों को धान कब बेचना चाहिए,किसानों को धान कब बेचना चाहिए,14.28571429,6.451612903,14.28571429,6.451612903,0.105553389,D_no_change
826,D:\SPIRE Internship\IISc_RESPIN_test_hi\D2\41243\IISc_RESPIN_hi_D2_41243_207247_F_AGRI_407655_40613037.wav,उर्वरक किसे कहते हैं ?,उर्वरक किसे कहते हैं ?,उर्वरक किसे कहते हैं,उर्वरक किसे कहते हैं,20.0,9.090909091,20.0,9.090909091,0.086087227,D_no_change
827,D:\SPIRE Internship\IISc_RESPIN_test_hi\D2\41243\IISc_RESPIN_hi_D2_41243_207247_F_BANK_408434_40613045.wav,अपना कार्ड ब्लॉक कैसे कर सकते हैं ?,अपना कार्ड ब्लॉक कैसे कर सकते हैं ?,अपना कार्ड ब्लॉक कैसे कर सकते हैं,अपना कार्ड ब्लॉक कैसे कर सकते हैं,12.5,5.714285714,12.5,5.714285714,0.101046562,D_no_change
828,D:\SPIRE Internship\IISc_RESPIN_test_hi\D2\41243\IISc_RESPIN_hi_D2_41243_207247_F_BANK_408379_40613064.wav,स्वास्थ्य बीमा कैसे कराएँ ?,स्वास्थ्य बीमा कैसे कराएँ ?,स्वास्थ्य बीमा कैसे कराएं,स्वास्थ्य बीमा कैसे कराएं,40.0,11.11111111,40.0,11.11111111,0.102471828,D_no_change
831,D:\SPIRE Internship\IISc_RESPIN_test_hi\D2\41686\IISc_RESPIN_hi_D2_41686_207241_F_BANK_404667_40900220.wav,हमारे घर के बुजुर्ग ज्यादातर एफ.डी में निवेश करते हैं,हमारे घर के बुजुर्ग ज्यादातर एफ.डी में निवेश करते हैं,हमारे घर के बुजुर्ग जायदातर आइफडी में निवेश करते हैं,हमारे घर के बुजुर्ग जायदातर आइफडी में निवेश करते हैं,20.0,9.433962264,20.0,9.433962264,0.1588974,D_no_change
832,D:\SPIRE Internship\IISc_RESPIN_test_hi\D2\41686\IISc_RESPIN_hi_D2_41686_207241_F_AGRI_406523_40900221.wav,कृषि विपणन में किसानो के हित उपभोगता के भी हितों की सुरक्षा होती है,कृषि विपणन में किसानो के हित उपभोगता के भी हितों की सुरक्षा होती है,कृकृषि विपणन में किसानों के हित उपभोक्ता के भी हितों की सुरक्षा होती है,कृकृषि विपणन में किसानों के हित उपभोक्ता के भी हितों की सुरक्षा होती है,21.42857143,7.462686567,21.42857143,7.462686567,0.170924425,D_no_change
834,D:\SPIRE Internship\IISc_RESPIN_test_hi\D2\41686\IISc_RESPIN_hi_D2_41686_207241_F_BANK_408363_40900307.wav,डेबिट कार्ड की लेनदेन की सीमा कितनी होती है ?,डेबिट कार्ड की लेनदेन की सीमा कितनी होती है ?,डेबिट कार्ड की लेनदेन की सीमा कितनी होती है,डेबिट कार्ड की लेनदेन की सीमा कितनी होती है,10.0,4.444444444,10.0,4.444444444,0.116174698,D_no_change
836,D:\SPIRE Internship\IISc_RESPIN_test_hi\D2\41686\IISc_RESPIN_hi_D2_41686_207241_F_BANK_408341_40900475.wav,मैं अपने एक छोटे से व्यवसाय के लिए कितना ऋण ले सकता हूँ ?,मैं अपने एक छोटे से व्यवसाय के लिए कितना ऋण ले सकता हूँ ?,मैं अपने एक छोटे से व्यवसाय के लिए कितना ऋण ले सकता हूं,मैं अपने एक छोटे से व्यवसाय के लिए कितना ऋण ले सकता हूं,14.28571429,5.263157895,14.28571429,5.263157895,0.146324396,D_no_change
837,D:\SPIRE Internship\IISc_RESPIN_test_hi\D2\41686\IISc_RESPIN_hi_D2_41686_207241_F_BANK_408374_40900747.wav,मैं अपने सेल फोन का बिल कैसे चुकाऊँ ?,मैं अपने सेल फोन का बिल कैसे चुकाऊँ ?,मैं अपने सेल फोन का बिल कैसे चुका हूं,मैं अपने सेल फोन का बिल कैसे चुका हूं,22.22222222,10.81081081,22.22222222,10.81081081,0.110223532,D_no_change
838,D:\SPIRE Internship\IISc_RESPIN_test_hi\D2\41686\IISc_RESPIN_hi_D2_41686_207241_F_BANK_408368_40900774.wav,खाते में ऑफलाइन पैसे कैसे जमा करें ?,खाते में ऑफलाइन पैसे कैसे जमा करें ?,खाते में ऑफ लॉइन पैसे कैसे जमा करें,खाते में ऑफ लॉइन पैसे कैसे जमा करें,37.5,11.11111111,37.5,11.11111111,0.103628397,D_no_change
839,D:\SPIRE Internship\IISc_RESPIN_test_hi\D2\41686\IISc_RESPIN_hi_D2_41686_207241_F_BANK_408379_40900809.wav,स्वास्थ्य बीमा कैसे कराएँ ?,स्वास्थ्य बीमा कैसे कराएँ ?,स्वास्थ्य बीमा कैसे कराएं,स्वास्थ्य बीमा कैसे कराएं,40.0,11.11111111,40.0,11.11111111,0.101790905,D_no_change
842,D:\SPIRE Internship\IISc_RESPIN_test_hi\D2\41686\IISc_RESPIN_hi_D2_41686_207241_F_AGRI_407703_40901068.wav,क्या हम मुद्रा विनिमय या व्यापारिक उद्देश्यों के लिए ऑनलाइन वित्तीय आदान प्रदान कर सकते हैं ?,क्या हम मुद्रा विनिमय या व्यापारिक उद्देश्यों के लिए ऑनलाइन वित्तीय आदान प्रदान कर सकते हैं ?,क्या हम मुद्रा विनिमय या व्यापारिक उद्देश्यों के लिए ऑनलाइन वित्तीय आदान प्रदान कर सकते हैं,क्या हम मुद्रा विनिमय या व्यापारिक उद्देश्यों के लिए ऑनलाइन वित्तीय आदान प्रदान कर सकते हैं,5.882352941,2.150537634,5.882352941,2.150537634,0.232465029,D_no_change
844,D:\SPIRE Internship\IISc_RESPIN_test_hi\D2\41701\IISc_RESPIN_hi_D2_41701_207241_M_BANK_405217_40873025.wav,पूँजी बाजार से आशय उस बाजार से है जो दीर्घकालीन ऋणों का लेन देन करता है,पूँजी बाजार से आशय उस बाजार से है जो दीर्घकालीन ऋणों का लेन देन करता है,पूंजी बाजार से आशय उस बाजार से है जो दीर्घकालीन ऋणों का ेनदेन करता है,पूंजी बाजार से आशय उस बाजार से है जो दीर्घकालीन ऋणों का ेनदेन करता है,18.75,4.225352113,18.75,4.225352113,0.223691702,D_no_change
846,D:\SPIRE Internship\IISc_RESPIN_test_hi\D2\41701\IISc_RESPIN_hi_D2_41701_207241_M_AGRI_405888_40873027.wav,"परागणकों के प्रकार है भौंरा , अल्फाल्फा लीफकटर मधुमक्खियां और बाग मेसन मधुमक्खियां","परागणकों के प्रकार है भौंरा , अल्फाल्फा लीफकटर मधुमक्खियां और बाग मेसन मधुमक्खियां",परागणकों के प्रकार हैं भौरा अल्फ ल्फा लीफ कटर मदुमक्खियाँ और बाग मेशन मधुमक्खियाँ,परागणकों के प्रकार हैं भौरा अल्फ ल्फा लीफ कटर मदुमक्खियाँ और बाग मेशन मधुमक्खियाँ,69.23076923,12.19512195,69.23076923,12.19512195,0.262090445,D_no_change
