sample_id,audio_path,reference,reference_normalized,prediction_raw,prediction_normalized,wer_raw,cer_raw,wer_normalized,cer_normalized,processing_time,category
47,D:\SPIRE Internship\IISc_RESPIN_test_hi\D1\40042\IISc_RESPIN_hi_D1_40042_251001_F_BANK_401332_40006407.wav,इंदिरा आवास योजना का नाम बदलकर प्रधानमंत्री आवास योजना मार्च दो हजार सोलह को रखा गया,इंदिरा आवास योजना का नाम बदलकर प्रधानमंत्री आवास योजना मार्च दो हजार सोलह को रखा गया,इंद्रा आवास योजना का नाम बदलकर प्रधानमंत्री आवास योजना मार्च <unk><unk><unk> को रखा गया,इंद्रा आवास योजना का नाम बदलकर प्रधानमंत्री आवास योजना मार्च <unk><unk><unk> को रखा गया,25.0,19.04761905,25.0,19.04761905,0.400126934,D_no_change
49,D:\SPIRE Internship\IISc_RESPIN_test_hi\D1\40042\IISc_RESPIN_hi_D1_40042_251001_F_AGRI_403745_40014913.wav,जुगाली करने वाले जानवर के आमाशय के कितने भाग होते हैं ?,जुगाली करने वाले जानवर के आमाशय के कितने भाग होते हैं ?,जुगाली करने वाले जानवर के अमाश्े के कितने भाग होते हैं,जुगाली करने वाले जानवर के अमाश्े के कितने भाग होते हैं,16.66666667,9.090909091,16.66666667,9.090909091,0.146684647,D_no_change
50,D:\SPIRE Internship\IISc_RESPIN_test_hi\D1\40042\IISc_RESPIN_hi_D1_40042_251001_F_BANK_403949_40014937.wav,पर्सनल लोन के लिए अप्लाई करने से पहले मुझे किन बातों का ध्यान रखना चाहिए ?,पर्सनल लोन के लिए अप्लाई करने से पहले मुझे किन बातों का ध्यान रखना चाहिए ?,पर्सनल लोन के लिए अप्लाई करने से पहले मुझे किन बातों का ध्यान रखना चाहिए,पर्सनल लोन के लिए अप्लाई करने से पहले मुझे किन बातों का ध्यान रखना चाहिए,6.25,2.702702703,6.25,2.702702703,0.189970255,D_no_change
51,D:\SPIRE Internship\IISc_RESPIN_test_hi\D1\40042\IISc_RESPIN_hi_D1_40042_251001_F_BANK_403953_40015608.wav,क्या मैं मासिक भुगतान वहन कर सकता हूँ ?,क्या मैं मासिक भुगतान वहन कर सकता हूँ ?,क्या मैं मासिक भुगतान वहन कर सकता हूं,क्या मैं मासिक भुगतान वहन कर सकता हूं,22.22222222,7.692307692,22.22222222,7.692307692,0.108348846,D_no_change
52,D:\SPIRE Internship\IISc_RESPIN_test_hi\D1\40042\IISc_RESPIN_hi_D1_40042_251001_F_AGRI_403471_40015614.wav,एक भैंस पालने में कितना खर्चा आता है ?,एक भैंस पालने में कितना खर्चा आता है ?,एक भैंस पालने में कितना खर्चा आता है,एक भैंस पालने में कितना खर्चा आता है,11.11111111,5.263157895,11.11111111,5.263157895,0.10962224,D_no_change
53,D:\SPIRE Internship\IISc_RESPIN_test_hi\D1\40048\IISc_RESPIN_hi_D1_40048_247001_M_BANK_402913_40069623.wav,"ऐतिहासिक रूप से , लाभांश के हकदार होने के प्रमाण के लिए प्रमाणपत्रों की आवश्यकता हो सकती है","ऐतिहासिक रूप से , लाभांश के हकदार होने के प्रमाण के लिए प्रमाणपत्रों की आवश्यकता हो सकती है",ऐतिहासिक रूप से लाभांश के हकदार होने के प्रमाण के लिए प्रमाण पत्रों की आवश्यकता हो सकती है,ऐतिहासिक रूप से लाभांश के हकदार होने के प्रमाण के लिए प्रमाण पत्रों की आवश्यकता हो सकती है,16.66666667,3.296703297,16.66666667,3.296703297,0.167361021,D_no_change
55,D:\SPIRE Internship\IISc_RESPIN_test_hi\D1\40048\IISc_RESPIN_hi_D1_40048_247001_M_BANK_401820_40108791.wav,भारतीय लेखा मानक के आने से व्यापारियों में बेईमानी कम हो गई है,भारतीय लेखा मानक के आने से व्यापारियों में बेईमानी कम हो गई है,भारतीय लेखा मानक के आने से व्यापारियों में बहिमानी कम हो गई है,भारतीय लेखा मानक के आने से व्यापारियों में बहिमानी कम हो गई है,7.692307692,3.225806452,7.692307692,3.225806452,0.147145987,D_no_change
57,D:\SPIRE Internship\IISc_RESPIN_test_hi\D1\40048\IISc_RESPIN_hi_D1_40048_247001_M_AGRI_403590_40128117.wav,किसानों को कौन सा बीज दिया जाता है ?,किसानों को कौन सा बीज दिया जाता है ?,किसानों को कौन सा बीज दिया जाता है,किसानों को कौन सा बीज दिया जाता है,11.11111111,5.555555556,11.11111111,5.555555556,0.061586857,D_no_change
58,D:\SPIRE Internship\IISc_RESPIN_test_hi\D1\40048\IISc_RESPIN_hi_D1_40048_247001_M_AGRI_403488_40128140.wav,गन्ने कि खेती कौन से मौसम में होती है ?,गन्ने कि खेती कौन से मौसम में होती है ?,गन्े की खेती कौन से मौसम में होती है,गन्े की खेती कौन से मौसम में होती है,30.0,10.25641026,30.0,10.25641026,0.100325346,D_no_change
59,D:\SPIRE Internship\IISc_RESPIN_test_hi\D1\40048\IISc_RESPIN_hi_D1_40048_247001_M_BANK_403887_40134012.wav,आप ऋण आय का उपयोग कैसे करेंगे ?,आप ऋण आय का उपयोग कैसे करेंगे ?,आप ऋण आय का उपयोग कैसे करेंगे,आप ऋण आय का उपयोग कैसे करेंगे,12.5,6.451612903,12.5,6.451612903,0.094607115,D_no_change
60,D:\SPIRE Internship\IISc_RESPIN_test_hi\D1\40048\IISc_RESPIN_hi_D1_40048_247001_M_BANK_403796_40134017.wav,निवेश के सिद्धांत क्या हैं ?,निवेश के सिद्धांत क्या हैं ?,निवेश के सिद्धांत क्या है,निवेश के सिद्धांत क्या है,33.33333333,10.71428571,33.33333333,10.71428571,0.077684164,D_no_change
61,D:\SPIRE Internship\IISc_RESPIN_test_hi\D1\40048\IISc_RESPIN_hi_D1_40048_247001_M_AGRI_403530_40134027.wav,सरसों की सिंचाई कितनी बार करनी चाहिए ?,सरसों की सिंचाई कितनी बार करनी चाहिए ?,सरसों की सिंचाई कितनी बार करनी चाहिए,सरसों की सिंचाई कितनी बार करनी चाहिए,12.5,5.263157895,12.5,5.263157895,0.099309444,D_no_change
62,D:\SPIRE Internship\IISc_RESPIN_test_hi\D1\40068\IISc_RESPIN_hi_D1_40068_251001_M_AGRI_402804_40199447.wav,कोदो बाजरा को किसी भी प्रकार की मिट्टी में उगाया जा सकता है,कोदो बाजरा को किसी भी प्रकार की मिट्टी में उगाया जा सकता है,को दो बाजरे को किसी भी प्रकार की मिट्टी में उवाया जा सकता है,को दो बाजरे को किसी भी प्रकार की मिट्टी में उवाया जा सकता है,30.76923077,5.084745763,30.76923077,5.084745763,0.145868301,D_no_change
63,D:\SPIRE Internship\IISc_RESPIN_test_hi\D1\40068\IISc_RESPIN_hi_D1_40068_251001_M_AGRI_400183_40199455.wav,बम्बूसा बांस दस मीटर तक लम्बा होता है,बम्बूसा बांस दस मीटर तक लम्बा होता है,बमबोसा बास <unk><unk> मीर तक लंबा होता है,बमबोसा बास <unk><unk> मीर तक लंबा होता है,62.5,43.24324324,62.5,43.24324324,0.114232779,D_no_change
65,D:\SPIRE Internship\IISc_RESPIN_test_hi\D1\40068\IISc_RESPIN_hi_D1_40068_251001_M_AGRI_401522_40201415.wav,बाजार में चिचिण्डा अब इतनी आसानी से नहीं मिलता,बाजार में चिचिण्डा अब इतनी आसानी से नहीं मिलता,बाजार में ची चिंडा अब इतनी आसानी से नहीं मिलता,बाजार में ची चिंडा अब इतनी आसानी से नहीं मिलता,22.22222222,8.695652174,22.22222222,8.695652174,0.117584705,D_no_change
66,D:\SPIRE Internship\IISc_RESPIN_test_hi\D1\40068\IISc_RESPIN_hi_D1_40068_251001_M_BANK_401820_40219229.wav,भारतीय लेखा मानक के आने से व्यापारियों में बेईमानी कम हो गई है,भारतीय लेखा मानक के आने से व्यापारियों में बेईमानी कम हो गई है,भारतीय लेखा मानक के आने से व्यापारियों में बेमानी कम हो गई है,भारतीय लेखा मानक के आने से व्यापारियों में बेमानी कम हो गई है,7.692307692,1.612903226,7.692307692,1.612903226,0.124998569,D_no_change
67,D:\SPIRE Internship\IISc_RESPIN_test_hi\D1\40068\IISc_RESPIN_hi_D1_40068_251001_M_AGRI_403206_40219460.wav,भारत में सबसे अधिक उपजाऊ मृदा कौन सी है ?,भारत में सबसे अधिक उपजाऊ मृदा कौन सी है ?,भारत में सबसे अधिक उपचौव मृदा कौनसी है,भारत में सबसे अधिक उपचौव मृदा कौनसी है,40.0,14.63414634,40.0,14.63414634,0.117275715,D_no_change
68,D:\SPIRE Internship\IISc_RESPIN_test_hi\D1\40068\IISc_RESPIN_hi_D1_40068_251001_M_BANK_403953_40219485.wav,क्या मैं मासिक भुगतान वहन कर सकता हूँ ?,क्या मैं मासिक भुगतान वहन कर सकता हूँ ?,क्या मैं मासिक भुगतान वहन कर सकता हूँ,क्या मैं मासिक भुगतान वहन कर सकता हूँ,11.11111111,5.128205128,11.11111111,5.128205128,0.095777273,D_no_change
70,D:\SPIRE Internship\IISc_RESPIN_test_hi\D1\40068\IISc_RESPIN_hi_D1_40068_251001_M_AGRI_403328_40219740.wav,फसल काट कर किस जगह बेचनी चाहिये ?,फसल काट कर किस जगह बेचनी चाहिये ?,फसल काटकर किस जगह बेचनी चाहिए,फसल काटकर किस जगह बेचनी चाहिए,50.0,15.15151515,50.0,15.15151515,0.106710196,D_no_change
71,D:\SPIRE Internship\IISc_RESPIN_test_hi\D1\40068\IISc_RESPIN_hi_D1_40068_251001_M_BANK_403824_40219775.wav,यू.पी.आई उदाहरण क्या है ?,यू.पी.आई उदाहरण क्या है ?,यो क्या एक उदाहरण क्या है,यो क्या एक उदाहरण क्या है,80.0,44.0,80.0,44.0,0.102123737,D_no_change
72,D:\SPIRE Internship\IISc_RESPIN_test_hi\D1\40068\IISc_RESPIN_hi_D1_40068_251001_M_BANK_404231_40219785.wav,ए.टी.एम से पैसे कहाँ कहाँ चुकाए जा सकते हैं ?,ए.टी.एम से पैसे कहाँ कहाँ चुकाए जा सकते हैं ?,एटीएम से पैसे का कहां चुकाए जा सकते हैं,एटीएम से पैसे का कहां चुकाए जा सकते हैं,40.0,15.55555556,40.0,15.55555556,0.101553202,D_no_change
73,D:\SPIRE Internship\IISc_RESPIN_test_hi\D1\40068\IISc_RESPIN_hi_D1_40068_251001_M_AGRI_403322_40219872.wav,प्रधानमंत्री फसल बीमा योजना का पैसा कैसे चेक करें ?,प्रधानमंत्री फसल बीमा योजना का पैसा कैसे चेक करें ?,प्रधानमंत्री फसल बीमा योजना का पैसा कैसे चेक करें,प्रधानमंत्री फसल बीमा योजना का पैसा कैसे चेक करें,10.0,3.921568627,10.0,3.921568627,0.114174843,D_no_change
74,D:\SPIRE Internship\IISc_RESPIN_test_hi\D1\40077\IISc_RESPIN_hi_D1_40077_247121_F_AGRI_400768_40058602.wav,जवारे बहुत ही अच्छा ग्लूटेन फ्री आटा होता है,जवारे बहुत ही अच्छा ग्लूटेन फ्री आटा होता है,जमारे बहुत ही अच्छा ग्लूटेन फ्री आटा होता है,जमारे बहुत ही अच्छा ग्लूटेन फ्री आटा होता है,11.11111111,2.272727273,11.11111111,2.272727273,0.097233295,D_no_change
76,D:\SPIRE Internship\IISc_RESPIN_test_hi\D1\40077\IISc_RESPIN_hi_D1_40077_247121_F_AGRI_400641_40059209.wav,कुछ कीटनाशक स्प्रेयर रॉकिंग स्प्रेयर होते हैं,कुछ कीटनाशक स्प्रेयर रॉकिंग स्प्रेयर होते हैं,कुछ कीटनासक अस्परेयर रोगिंग अस्प्रेयर होते हैं,कुछ कीटनासक अस्परेयर रोगिंग अस्प्रेयर होते हैं,57.14285714,13.33333333,57.14285714,13.33333333,0.114265203,D_no_change
77,D:\SPIRE Internship\IISc_RESPIN_test_hi\D1\40077\IISc_RESPIN_hi_D1_40077_247121_F_AGRI_402067_40059234.wav,लेयर मुर्गियां दो या तीन प्रकार की होती है,लेयर मुर्गियां दो या तीन प्रकार की होती है,लेयर मुर्गियां दो या तीन प्रकार की होती हैं,लेयर मुर्गियां दो या तीन प्रकार की होती हैं,11.11111111,2.380952381,11.11111111,2.380952381,0.097765446,D_no_change
78,D:\SPIRE Internship\IISc_RESPIN_test_hi\D1\40077\IISc_RESPIN_hi_D1_40077_247121_F_AGRI_400274_40071584.wav,डैफोडील्स के फूल दिखने में बहुत सुंदर होते है,डैफोडील्स के फूल दिखने में बहुत सुंदर होते है,डेफोडिल्स के फूल दिखने में बहुत सुंदर होते हैं,डेफोडिल्स के फूल दिखने में बहुत सुंदर होते हैं,22.22222222,6.666666667,22.22222222,6.666666667,0.116378069,D_no_change
80,D:\SPIRE Internship\IISc_RESPIN_test_hi\D1\40077\IISc_RESPIN_hi_D1_40077_247121_F_BANK_403796_40139933.wav,निवेश के सिद्धांत क्या हैं ?,निवेश के सिद्धांत क्या हैं ?,निवेश के सिद्धांत क्या है,निवेश के सिद्धांत क्या है,33.33333333,10.71428571,33.33333333,10.71428571,0.063180447,D_no_change
81,D:\SPIRE Internship\IISc_RESPIN_test_hi\D1\40077\IISc_RESPIN_hi_D1_40077_247121_F_AGRI_403195_40139937.wav,रबी फसल के दो उदाहरण दीजिए ?,रबी फसल के दो उदाहरण दीजिए ?,रवी फसल के दो उदाहरण दीजिए,रवी फसल के दो उदाहरण दीजिए,28.57142857,10.71428571,28.57142857,10.71428571,0.082095861,D_no_change
82,D:\SPIRE Internship\IISc_RESPIN_test_hi\D1\40077\IISc_RESPIN_hi_D1_40077_247121_F_BANK_403824_40141045.wav,यू.पी.आई उदाहरण क्या है ?,यू.पी.आई उदाहरण क्या है ?,यूपीआई उदाहरण क्या है,यूपीआई उदाहरण क्या है,40.0,16.0,40.0,16.0,0.058032513,D_no_change
83,D:\SPIRE Internship\IISc_RESPIN_test_hi\D1\40077\IISc_RESPIN_hi_D1_40077_247121_F_AGRI_403488_40141282.wav,गन्ने कि खेती कौन से मौसम में होती है ?,गन्ने कि खेती कौन से मौसम में होती है ?,गन्ने की खेती कौन से मौसम में होती है,गन्ने की खेती कौन से मौसम में होती है,20.0,7.692307692,20.0,7.692307692,0.100199699,D_no_change
84,D:\SPIRE Internship\IISc_RESPIN_test_hi\D1\40077\IISc_RESPIN_hi_D1_40077_247121_F_AGRI_403250_40141424.wav,जलवायु और मौसम में क्या अंतर है ?,जलवायु और मौसम में क्या अंतर है ?,जलवायु और मौसम में क्या अंतर है,जलवायु और मौसम में क्या अंतर है,12.5,6.060606061,12.5,6.060606061,0.079820395,D_no_change
85,D:\SPIRE Internship\IISc_RESPIN_test_hi\D1\40115\IISc_RESPIN_hi_D1_40115_251001_M_BANK_401820_40210819.wav,भारतीय लेखा मानक के आने से व्यापारियों में बेईमानी कम हो गई है,भारतीय लेखा मानक के आने से व्यापारियों में बेईमानी कम हो गई है,भारतीय लेखा मानक के आने से व्यापारियों में वैमानी कम हो गई है,भारतीय लेखा मानक के आने से व्यापारियों में वैमानी कम हो गई है,7.692307692,4.838709677,7.692307692,4.838709677,0.158305645,D_no_change
87,D:\SPIRE Internship\IISc_RESPIN_test_hi\D1\40115\IISc_RESPIN_hi_D1_40115_251001_M_BANK_402002_40232904.wav,डिजिटल मुद्रा को कैसे संग्रहित करेंगे ?,डिजिटल मुद्रा को कैसे संग्रहित करेंगे ?,डिजिटल मुद्रा को कैसे संग्रहित करेंगे,डिजिटल मुद्रा को कैसे संग्रहित करेंगे,14.28571429,5.128205128,14.28571429,5.128205128,0.100037575,D_no_change
89,D:\SPIRE Internship\IISc_RESPIN_test_hi\D1\40115\IISc_RESPIN_hi_D1_40115_251001_M_AGRI_403195_40233297.wav,रबी फसल के दो उदाहरण दीजिए ?,रबी फसल के दो उदाहरण दीजिए ?,रबवी फसल के दो उदाहरण दीजिए,रबवी फसल के दो उदाहरण दीजिए,28.57142857,10.71428571,28.57142857,10.71428571,0.062748671,D_no_change
90,D:\SPIRE Internship\IISc_RESPIN_test_hi\D1\40115\IISc_RESPIN_hi_D1_40115_251001_M_AGRI_403745_40233303.wav,जुगाली करने वाले जानवर के आमाशय के कितने भाग होते हैं ?,जुगाली करने वाले जानवर के आमाशय के कितने भाग होते हैं ?,जुगाली करने वाले जानवर के अमाशय के कितने भाग होते हैं,जुगाली करने वाले जानवर के अमाशय के कितने भाग होते हैं,16.66666667,5.454545455,16.66666667,5.454545455,0.118731737,D_no_change
91,D:\SPIRE Internship\IISc_RESPIN_test_hi\D1\40115\IISc_RESPIN_hi_D1_40115_251001_M_BANK_403953_40233305.wav,क्या मैं मासिक भुगतान वहन कर सकता हूँ ?,क्या मैं मासिक भुगतान वहन कर सकता हूँ ?,क्या मैं मासिक भुगतान वहन कर सकता हूं,क्या मैं मासिक भुगतान वहन कर सकता हूं,22.22222222,7.692307692,22.22222222,7.692307692,0.09977293,D_no_change
92,D:\SPIRE Internship\IISc_RESPIN_test_hi\D1\40115\IISc_RESPIN_hi_D1_40115_251001_M_BANK_404297_40235241.wav,के.वाई.सी के चार स्तंभ क्या हैं ?,के.वाई.सी के चार स्तंभ क्या हैं ?,केवासी के चार स्तंभ क्या है,केवासी के चार स्तंभ क्या है,42.85714286,18.18181818,42.85714286,18.18181818,0.076120615,D_no_change
93,D:\SPIRE Internship\IISc_RESPIN_test_hi\D1\40115\IISc_RESPIN_hi_D1_40115_251001_M_BANK_404231_40235744.wav,ए.टी.एम से पैसे कहाँ कहाँ चुकाए जा सकते हैं ?,ए.टी.एम से पैसे कहाँ कहाँ चुकाए जा सकते हैं ?,एटीएम से पैसे कहां कहां चुकाए जा सकते हैं,एटीएम से पैसे कहां कहां चुकाए जा सकते हैं,40.0,13.33333333,40.0,13.33333333,0.103064537,D_no_change
94,D:\SPIRE Internship\IISc_RESPIN_test_hi\D1\40115\IISc_RESPIN_hi_D1_40115_251001_M_BANK_403833_40235767.wav,गैर बैंकिंग गतिविधियाँ क्या हैं ?,गैर बैंकिंग गतिविधियाँ क्या हैं ?,गैर बैंकिंग गतिविधियाँ क्या हैं,गैर बैंकिंग गतिविधियाँ क्या हैं,16.66666667,6.060606061,16.66666667,6.060606061,0.083264589,D_no_change
95,D:\SPIRE Internship\IISc_RESPIN_test_hi\D1\40115\IISc_RESPIN_hi_D1_40115_251001_M_AGRI_403338_40235902.wav,पशु आहार कैसे बनाएं ?,पशु आहार कैसे बनाएं ?,पशु आहार कैसे बनाए,पशु आहार कैसे बनाए,40.0,14.28571429,40.0,14.28571429,0.062619686,D_no_change
96,D:\SPIRE Internship\IISc_RESPIN_test_hi\D1\40115\IISc_RESPIN_hi_D1_40115_251001_M_AGRI_403680_40236028.wav,कौन सी मिट्टी सबसे उपजाऊ है ?,कौन सी मिट्टी सबसे उपजाऊ है ?,कौन सी मिट्टी सबसे उपजाऊ है,कौन सी मिट्टी सबसे उपजाऊ है,14.28571429,6.896551724,14.28571429,6.896551724,0.053035021,D_no_change
