sample_id,audio_path,reference,reference_normalized,prediction_raw,prediction_normalized,wer_raw,cer_raw,wer_normalized,cer_normalized,processing_time,category
0,D:\SPIRE Internship\IISc_RESPIN_test_hi\D1\40020\IISc_RESPIN_hi_D1_40020_251001_F_BANK_400077_40189102.wav,ऋण गारंटी को अमीर और भरोसेमंद आदमी ही दे सकता है,ऋण गारंटी को अमीर और भरोसेमंद आदमी ही दे सकता है,ऋण गारंटी को अमीर और भरोसेमंद आदमी ही दे सकता है,ऋण गारंटी को अमीर और भरोसेमंद आदमी ही दे सकता है,0.0,0.0,0.0,0.0,17.1866641,A_all_zero
16,D:\SPIRE Internship\IISc_RESPIN_test_hi\D1\40024\IISc_RESPIN_hi_D1_40024_251001_M_AGRI_402684_40056554.wav,जुरशीतल बिहार के मिथिला एवं नेपाल का फसल उत्सव है,जुरशीतल बिहार के मिथिला एवं नेपाल का फसल उत्सव है,जुरशीतल बिहार के मिथिला एवं नेपाल का फसल उत्सव है,जुरशीतल बिहार के मिथिला एवं नेपाल का फसल उत्सव है,0.0,0.0,0.0,0.0,0.264255285,A_all_zero
23,D:\SPIRE Internship\IISc_RESPIN_test_hi\D1\40027\IISc_RESPIN_hi_D1_40027_251001_F_BANK_402786_40206136.wav,भागलपुर में तीन साल में कई नए क्रेडिट यूनियन खुल गए हैं,भागलपुर में तीन साल में कई नए क्रेडिट यूनियन खुल गए हैं,भागलपुर में तीन साल में कई नए क्रेडिट यूनियन खुल गए हैं,भागलपुर में तीन साल में कई नए क्रेडिट यूनियन खुल गए हैं,0.0,0.0,0.0,0.0,0.159240007,A_all_zero
37,D:\SPIRE Internship\IISc_RESPIN_test_hi\D1\40029\IISc_RESPIN_hi_D1_40029_251001_F_BANK_400385_40108393.wav,मैं कल अपनी पत्नी के साथ एक संयुक्त खाता खुलवाया,मैं कल अपनी पत्नी के साथ एक संयुक्त खाता खुलवाया,मैं कल अपनी पत्नी के साथ एक संयुक्त खाता खुलवाया,मैं कल अपनी पत्नी के साथ एक संयुक्त खाता खुलवाया,0.0,0.0,0.0,0.0,0.116087914,A_all_zero
44,D:\SPIRE Internship\IISc_RESPIN_test_hi\D1\40042\IISc_RESPIN_hi_D1_40042_251001_F_BANK_400361_40000764.wav,कर माफी उन लोगों के लिए है जो सालों से अपनी संपत्ति को छिपाते हैं,कर माफी उन लोगों के लिए है जो सालों से अपनी संपत्ति को छिपाते हैं,कर माफी उन लोगों के लिए है जो सालों से अपनी संपत्ति को छिपाते हैं,कर माफी उन लोगों के लिए है जो सालों से अपनी संपत्ति को छिपाते हैं,0.0,0.0,0.0,0.0,0.174265385,A_all_zero
45,D:\SPIRE Internship\IISc_RESPIN_test_hi\D1\40042\IISc_RESPIN_hi_D1_40042_251001_F_BANK_401691_40000785.wav,ऑडिटर ने खाता बखूबी मिलाया,ऑडिटर ने खाता बखूबी मिलाया,ऑडिटर ने खाता बखूबी मिलाया,ऑडिटर ने खाता बखूबी मिलाया,0.0,0.0,0.0,0.0,0.097535372,A_all_zero
56,D:\SPIRE Internship\IISc_RESPIN_test_hi\D1\40048\IISc_RESPIN_hi_D1_40048_247001_M_AGRI_402684_40108800.wav,जुरशीतल बिहार के मिथिला एवं नेपाल का फसल उत्सव है,जुरशीतल बिहार के मिथिला एवं नेपाल का फसल उत्सव है,जुरशीतल बिहार के मिथिला एवं नेपाल का फसल उत्सव है,जुरशीतल बिहार के मिथिला एवं नेपाल का फसल उत्सव है,0.0,0.0,0.0,0.0,0.122347832,A_all_zero
100,D:\SPIRE Internship\IISc_RESPIN_test_hi\D1\40634\IISc_RESPIN_hi_D1_40634_247771_M_BANK_400361_40430779.wav,कर माफी उन लोगों के लिए है जो सालों से अपनी संपत्ति को छिपाते हैं,कर माफी उन लोगों के लिए है जो सालों से अपनी संपत्ति को छिपाते हैं,कर माफी उन लोगों के लिए है जो सालों से अपनी संपत्ति को छिपाते हैं,कर माफी उन लोगों के लिए है जो सालों से अपनी संपत्ति को छिपाते हैं,0.0,0.0,0.0,0.0,0.230032444,A_all_zero
110,D:\SPIRE Internship\IISc_RESPIN_test_hi\D1\40637\IISc_RESPIN_hi_D1_40637_251001_M_BANK_402786_40415571.wav,भागलपुर में तीन साल में कई नए क्रेडिट यूनियन खुल गए हैं,भागलपुर में तीन साल में कई नए क्रेडिट यूनियन खुल गए हैं,भागलपुर में तीन साल में कई नए क्रेडिट यूनियन खुल गए हैं,भागलपुर में तीन साल में कई नए क्रेडिट यूनियन खुल गए हैं,0.0,0.0,0.0,0.0,0.119959116,A_all_zero
111,D:\SPIRE Internship\IISc_RESPIN_test_hi\D1\40637\IISc_RESPIN_hi_D1_40637_251001_M_AGRI_401185_40415594.wav,रोहित ने कहा कि उसे अदरक खाना पसंद नहीं है,रोहित ने कहा कि उसे अदरक खाना पसंद नहीं है,रोहित ने कहा कि उसे अदरक खाना पसंद नहीं है,रोहित ने कहा कि उसे अदरक खाना पसंद नहीं है,0.0,0.0,0.0,0.0,0.100253344,A_all_zero
120,D:\SPIRE Internship\IISc_RESPIN_test_hi\D1\40664\IISc_RESPIN_hi_D1_40664_251001_F_BANK_402852_40558045.wav,कुशल अपना नया व्यापार शुरू करने के लिए पूंजी बाजार से मशीनरी खरीदी,कुशल अपना नया व्यापार शुरू करने के लिए पूंजी बाजार से मशीनरी खरीदी,कुशल अपना नया व्यापार शुरू करने के लिए पूंजी बाजार से मशीनरी खरीदी,कुशल अपना नया व्यापार शुरू करने के लिए पूंजी बाजार से मशीनरी खरीदी,0.0,0.0,0.0,0.0,0.156001568,A_all_zero
130,D:\SPIRE Internship\IISc_RESPIN_test_hi\D1\40670\IISc_RESPIN_hi_D1_40670_251001_F_AGRI_402684_40455426.wav,जुरशीतल बिहार के मिथिला एवं नेपाल का फसल उत्सव है,जुरशीतल बिहार के मिथिला एवं नेपाल का फसल उत्सव है,जुरशीतल बिहार के मिथिला एवं नेपाल का फसल उत्सव है,जुरशीतल बिहार के मिथिला एवं नेपाल का फसल उत्सव है,0.0,0.0,0.0,0.0,0.143699884,A_all_zero
145,D:\SPIRE Internship\IISc_RESPIN_test_hi\D1\40702\IISc_RESPIN_hi_D1_40702_251001_F_AGRI_400070_40350317.wav,मवेशियों का परिवेश उनके लिए आरामदायक होना चाहिए,मवेशियों का परिवेश उनके लिए आरामदायक होना चाहिए,मवेशियों का परिवेश उनके लिए आरामदायक होना चाहिए,मवेशियों का परिवेश उनके लिए आरामदायक होना चाहिए,0.0,0.0,0.0,0.0,0.121138573,A_all_zero
146,D:\SPIRE Internship\IISc_RESPIN_test_hi\D1\40702\IISc_RESPIN_hi_D1_40702_251001_F_BANK_401691_40354835.wav,ऑडिटर ने खाता बखूबी मिलाया,ऑडिटर ने खाता बखूबी मिलाया,ऑडिटर ने खाता बखूबी मिलाया,ऑडिटर ने खाता बखूबी मिलाया,0.0,0.0,0.0,0.0,0.096970081,A_all_zero
159,D:\SPIRE Internship\IISc_RESPIN_test_hi\D1\40715\IISc_RESPIN_hi_D1_40715_251001_F_AGRI_401347_40378634.wav,चिरौंजी एक सूखा मेवा है,चिरौंजी एक सूखा मेवा है,चिरौंजी एक सूखा मेवा है,चिरौंजी एक सूखा मेवा है,0.0,0.0,0.0,0.0,0.101766348,A_all_zero
162,D:\SPIRE Internship\IISc_RESPIN_test_hi\D1\40715\IISc_RESPIN_hi_D1_40715_251001_F_AGRI_402305_40413469.wav,परवल की मिठाई भी बनाई जाती है,परवल की मिठाई भी बनाई जाती है,परवल की मिठाई भी बनाई जाती है,परवल की मिठाई भी बनाई जाती है,0.0,0.0,0.0,0.0,0.107896805,A_all_zero
172,D:\SPIRE Internship\IISc_RESPIN_test_hi\D1\40725\IISc_RESPIN_hi_D1_40725_251001_F_BANK_402852_40395131.wav,कुशल अपना नया व्यापार शुरू करने के लिए पूंजी बाजार से मशीनरी खरीदी,कुशल अपना नया व्यापार शुरू करने के लिए पूंजी बाजार से मशीनरी खरीदी,कुशल अपना नया व्यापार शुरू करने के लिए पूंजी बाजार से मशीनरी खरीदी,कुशल अपना नया व्यापार शुरू करने के लिए पूंजी बाजार से मशीनरी खरीदी,0.0,0.0,0.0,0.0,0.193972588,A_all_zero
174,D:\SPIRE Internship\IISc_RESPIN_test_hi\D1\40725\IISc_RESPIN_hi_D1_40725_251001_F_AGRI_402305_40396291.wav,परवल की मिठाई भी बनाई जाती है,परवल की मिठाई भी बनाई जाती है,परवल की मिठाई भी बनाई जाती है,परवल की मिठाई भी बनाई जाती है,0.0,0.0,0.0,0.0,0.098018169,A_all_zero
202,D:\SPIRE Internship\IISc_RESPIN_test_hi\D1\40766\IISc_RESPIN_hi_D1_40766_700046_F_AGRI_400788_40329092.wav,मेरे दोस्त के पिता टेरेस खेती करते हैं,मेरे दोस्त के पिता टेरेस खेती करते हैं,मेरे दोस्त के पिता टेरेस खेती करते हैं,मेरे दोस्त के पिता टेरेस खेती करते हैं,0.0,0.0,0.0,0.0,0.118195057,A_all_zero
204,D:\SPIRE Internship\IISc_RESPIN_test_hi\D1\40766\IISc_RESPIN_hi_D1_40766_700046_F_AGRI_400853_40435597.wav,मुझे पुदीने की चटनी पसंद है,मुझे पुदीने की चटनी पसंद है,मुझे पुदीने की चटनी पसंद है,मुझे पुदीने की चटनी पसंद है,0.0,0.0,0.0,0.0,0.118160963,A_all_zero
206,D:\SPIRE Internship\IISc_RESPIN_test_hi\D1\40766\IISc_RESPIN_hi_D1_40766_700046_F_AGRI_400821_40459559.wav,कृष्णा वैली गाय महाराष्ट्र में पाई जाती है,कृष्णा वैली गाय महाराष्ट्र में पाई जाती है,कृष्णा वैली गाय महाराष्ट्र में पाई जाती है,कृष्णा वैली गाय महाराष्ट्र में पाई जाती है,0.0,0.0,0.0,0.0,0.121975183,A_all_zero
219,D:\SPIRE Internship\IISc_RESPIN_test_hi\D1\41209\IISc_RESPIN_hi_D1_41209_251001_M_AGRI_421558_40728127.wav,सहकारी समितियों और किसान स्वामित्व वाली दूध उत्पादक कंपनियों की कार्यशील पूंजी की जरूरतों को पूरा करता है,सहकारी समितियों और किसान स्वामित्व वाली दूध उत्पादक कंपनियों की कार्यशील पूंजी की जरूरतों को पूरा करता है,सहकारी समितियों और किसान स्वामित्व वाली दूध उत्पादक कंपनियों की कार्यशील पूंजी की जरूरतों को पूरा करता है,सहकारी समितियों और किसान स्वामित्व वाली दूध उत्पादक कंपनियों की कार्यशील पूंजी की जरूरतों को पूरा करता है,0.0,0.0,0.0,0.0,0.159739733,A_all_zero
301,D:\SPIRE Internship\IISc_RESPIN_test_hi\D1\41648\IISc_RESPIN_hi_D1_41648_NA_F_BANK_402310_40933309.wav,ब्लैंक चेक का प्रयोग व्यापार जगत में किसी सौदेबाजी में होती है,ब्लैंक चेक का प्रयोग व्यापार जगत में किसी सौदेबाजी में होती है,ब्लैंक चेक का प्रयोग व्यापार जगत में किसी सौदेबाजी में होती है,ब्लैंक चेक का प्रयोग व्यापार जगत में किसी सौदेबाजी में होती है,0.0,0.0,0.0,0.0,0.201835871,A_all_zero
302,D:\SPIRE Internship\IISc_RESPIN_test_hi\D1\41648\IISc_RESPIN_hi_D1_41648_NA_F_AGRI_402804_40933317.wav,कोदो बाजरा को किसी भी प्रकार की मिट्टी में उगाया जा सकता है,कोदो बाजरा को किसी भी प्रकार की मिट्टी में उगाया जा सकता है,कोदो बाजरा को किसी भी प्रकार की मिट्टी में उगाया जा सकता है,कोदो बाजरा को किसी भी प्रकार की मिट्टी में उगाया जा सकता है,0.0,0.0,0.0,0.0,0.151852608,A_all_zero
314,D:\SPIRE Internship\IISc_RESPIN_test_hi\D1\41667\IISc_RESPIN_hi_D1_41667_251001_M_AGRI_402804_40931020.wav,कोदो बाजरा को किसी भी प्रकार की मिट्टी में उगाया जा सकता है,कोदो बाजरा को किसी भी प्रकार की मिट्टी में उगाया जा सकता है,कोदो बाजरा को किसी भी प्रकार की मिट्टी में उगाया जा सकता है,कोदो बाजरा को किसी भी प्रकार की मिट्टी में उगाया जा सकता है,0.0,0.0,0.0,0.0,0.114938498,A_all_zero
322,D:\SPIRE Internship\IISc_RESPIN_test_hi\D1\41672\IISc_RESPIN_hi_D1_41672_249145_F_BANK_402381_40951054.wav,कर से तकनीकी प्रगति की तेजी हुई है,कर से तकनीकी प्रगति की तेजी हुई है,कर से तकनीकी प्रगति की तेजी हुई है,कर से तकनीकी प्रगति की तेजी हुई है,0.0,0.0,0.0,0.0,0.102612734,A_all_zero
331,D:\SPIRE Internship\IISc_RESPIN_test_hi\D1\41680\IISc_RESPIN_hi_D1_41680_251001_M_AGRI_402804_40928089.wav,कोदो बाजरा को किसी भी प्रकार की मिट्टी में उगाया जा सकता है,कोदो बाजरा को किसी भी प्रकार की मिट्टी में उगाया जा सकता है,कोदो बाजरा को किसी भी प्रकार की मिट्टी में उगाया जा सकता है,कोदो बाजरा को किसी भी प्रकार की मिट्टी में उगाया जा सकता है,0.0,0.0,0.0,0.0,0.150769949,A_all_zero
338,D:\SPIRE Internship\IISc_RESPIN_test_hi\D1\41918\IISc_RESPIN_hi_D1_41918_251001_F_BANK_401691_40843139.wav,ऑडिटर ने खाता बखूबी मिलाया,ऑडिटर ने खाता बखूबी मिलाया,ऑडिटर ने खाता बखूबी मिलाया,ऑडिटर ने खाता बखूबी मिलाया,0.0,0.0,0.0,0.0,0.058106422,A_all_zero
360,D:\SPIRE Internship\IISc_RESPIN_test_hi\D1\42045\IISc_RESPIN_hi_D1_42045_251001_F_BANK_401357_40958459.wav,सोहेल अपनी बेटी को वित्त विश्लेषक बनाना चाहता है,सोहेल अपनी बेटी को वित्त विश्लेषक बनाना चाहता है,सोहेल अपनी बेटी को वित्त विश्लेषक बनाना चाहता है,सोहेल अपनी बेटी को वित्त विश्लेषक बनाना चाहता है,0.0,0.0,0.0,0.0,0.102884531,A_all_zero
388,D:\SPIRE Internship\IISc_RESPIN_test_hi\D1\42470\IISc_RESPIN_hi_D1_42470_251001_M_BANK_400077_41143275.wav,ऋण गारंटी को अमीर और भरोसेमंद आदमी ही दे सकता है,ऋण गारंटी को अमीर और भरोसेमंद आदमी ही दे सकता है,ऋण गारंटी को अमीर और भरोसेमंद आदमी ही दे सकता है,ऋण गारंटी को अमीर और भरोसेमंद आदमी ही दे सकता है,0.0,0.0,0.0,0.0,0.132005453,A_all_zero
396,D:\SPIRE Internship\IISc_RESPIN_test_hi\D1\42471\IISc_RESPIN_hi_D1_42471_251001_M_AGRI_400853_41202963.wav,मुझे पुदीने की चटनी पसंद है,मुझे पुदीने की चटनी पसंद है,मुझे पुदीने की चटनी पसंद है,मुझे पुदीने की चटनी पसंद है,0.0,0.0,0.0,0.0,0.107611418,A_all_zero
419,D:\SPIRE Internship\IISc_RESPIN_test_hi\D2\40357\IISc_RESPIN_hi_D2_40357_207241_F_BANK_406319_40104902.wav,शहर की गलियों में रास्ते यूनिवर्सल बैंक के द्वारा दिए हुए पैसों से बनी है,शहर की गलियों में रास्ते यूनिवर्सल बैंक के द्वारा दिए हुए पैसों से बनी है,शहर की गलियों में रास्ते यूनिवर्सल बैंक के द्वारा दिए हुए पैसों से बनी है,शहर की गलियों में रास्ते यूनिवर्सल बैंक के द्वारा दिए हुए पैसों से बनी है,0.0,0.0,0.0,0.0,0.196234465,A_all_zero
459,D:\SPIRE Internship\IISc_RESPIN_test_hi\D2\40435\IISc_RESPIN_hi_D2_40435_207125_M_AGRI_406698_40114562.wav,ई कॉमर्स सेवाओं और वस्तुओं दोनों पक्षों के बीच खरीद और बिक्री को संदर्भित करता है,ई कॉमर्स सेवाओं और वस्तुओं दोनों पक्षों के बीच खरीद और बिक्री को संदर्भित करता है,ई कॉमर्स सेवाओं और वस्तुओं दोनों पक्षों के बीच खरीद और बिक्री को संदर्भित करता है,ई कॉमर्स सेवाओं और वस्तुओं दोनों पक्षों के बीच खरीद और बिक्री को संदर्भित करता है,0.0,0.0,0.0,0.0,0.255676031,A_all_zero
466,D:\SPIRE Internship\IISc_RESPIN_test_hi\D2\40435\IISc_RESPIN_hi_D2_40435_207125_M_AGRI_404455_40135055.wav,रोहण ने बताया कि वह प्रकृति में जल वितरण के बारे में एक आलेख लिख रहा है,रोहण ने बताया कि वह प्रकृति में जल वितरण के बारे में एक आलेख लिख रहा है,रोहण ने बताया कि वह प्रकृति में जल वितरण के बारे में एक आलेख लिख रहा है,रोहण ने बताया कि वह प्रकृति में जल वितरण के बारे में एक आलेख लिख रहा है,0.0,0.0,0.0,0.0,0.16604352,A_all_zero
475,D:\SPIRE Internship\IISc_RESPIN_test_hi\D2\40443\IISc_RESPIN_hi_D2_40443_207241_F_BANK_406738_40088576.wav,भारत में मनरेगा एक जॉब गारंटी योजना है,भारत में मनरेगा एक जॉब गारंटी योजना है,भारत में मनरेगा एक जॉब गारंटी योजना है,भारत में मनरेगा एक जॉब गारंटी योजना है,0.0,0.0,0.0,0.0,0.102060795,A_all_zero
584,D:\SPIRE Internship\IISc_RESPIN_test_hi\D2\40500\IISc_RESPIN_hi_D2_40500_207001_M_AGRI_406570_40150667.wav,जब कटहल कच्चा होता है तो इसका एक तटस्थ स्वाद होता है,जब कटहल कच्चा होता है तो इसका एक तटस्थ स्वाद होता है,जब कटहल कच्चा होता है तो इसका एक तटस्थ स्वाद होता है,जब कटहल कच्चा होता है तो इसका एक तटस्थ स्वाद होता है,0.0,0.0,0.0,0.0,0.198056936,A_all_zero
651,D:\SPIRE Internship\IISc_RESPIN_test_hi\D2\40818\IISc_RESPIN_hi_D2_40818_207001_F_AGRI_406448_40261388.wav,फॉरेस्ट गार्डनिंग में जमीन उपजाऊ बना रहता है,फॉरेस्ट गार्डनिंग में जमीन उपजाऊ बना रहता है,फॉरेस्ट गार्डनिंग में जमीन उपजाऊ बना रहता है,फॉरेस्ट गार्डनिंग में जमीन उपजाऊ बना रहता है,0.0,0.0,0.0,0.0,0.122631311,A_all_zero
664,D:\SPIRE Internship\IISc_RESPIN_test_hi\D2\40827\IISc_RESPIN_hi_D2_40827_207001_M_BANK_404807_40301675.wav,मुझे खुशी है कि भारत में अब एक महिला वित्त मंत्री है,मुझे खुशी है कि भारत में अब एक महिला वित्त मंत्री है,मुझे खुशी है कि भारत में अब एक महिला वित्त मंत्री है,मुझे खुशी है कि भारत में अब एक महिला वित्त मंत्री है,0.0,0.0,0.0,0.0,0.145278215,A_all_zero
